{
  "manifest_version": 1,
  "match": { "project": "chronicle" },
  "home": 0,
  "soul": {
    "name": "Project Agent",
    "char": "Hunter",
    "accent": "#4f7d5b",
    "role": "test project worker",
    "description": "A project-scoped resident used only by tests."
  },
  "skills": [
    { "id": "event-projection", "status_ref": "repository:village_state.py" }
  ],
  "memory": { "ref": "repository:CONTEXT.md", "status_ref": "version-controlled" },
  "routes": [],
  "app_grants": []
}
